{
  "agent": "channel_strategy",
  "company": "docebo-agenthub",
  "scenario_type": "new_product_launch",
  "generated_at": "2026-06-14T00:00:00Z",
  "section_a_gtm_motion": {
    "recommended_motion": "Hybrid: dominant Sales-led land-and-expand off the existing Docebo LMS install base, with a lighter sales-assisted / guided-POC motion for AI-forward net-new accounts, and a partner/channel + MCP-ecosystem layer for distribution and EMEA/DACH reach. Confidence: High.",
    "justification": {
      "deal_size_factor": "Agent 1 Q9 benchmarks LMS deals at ~$72K average reaching well into six figures, and Agent 1 Q6 positions AgentHub in the premium AI-native tier (~$30-65 PEPM, above core LMS ~$6-11) with an inferred platform-base + AI-consumption architecture. A six-figure-leaning, premium, multi-product (learning + knowledge + skills) deal cannot be self-serve PLG - it needs a quota-carrying field motion to justify the ACV. Pure PLG (the Copilot outlier) only works for a $30/seat horizontal add-on, which AgentHub is not. The expansion layer (AI-credit/agentic-consumption usage) does support a usage-based expand motion AFTER the platform land, so the deal economics favor sales-led land + consumption-expand, not bottom-up self-serve.",
      "committee_complexity": "Agent 1 Q9 / Agent 2 buying_committee document a ~11-person committee (CHRO/CFO decision makers, CLO/VP L&D champion, IT + LMS admin evaluators, CISO/DPO blocker, Procurement gatekeeper) on 6-12 month cycles, lengthening because an agentic system touching employee data across 20+ sources raises the IT/Security/governance bar. An 11-stakeholder consensus sale is structurally incompatible with PLG and demands consultative selling, executive alignment, and a security/compliance proof track - the defining signature of a sales-led enterprise motion. Agent 2 notes early-adopter deals can be champion-led (CLO + Head of AI co-sponsor compresses the committee), which is why a lighter guided-POC motion works for net-new AI-forward accounts but still sits inside a sales-assisted frame, not PLG.",
      "market_maturity": "Agent 1 Q1/Q8/Q10 classify the converged 'learning + knowledge + skills + agentic AI' category as Emerging/unsized inside Growth-stage adjacent markets, with AgentHub's own agents not GA until fall 2026 and category-establishment risk rated High. Emerging categories require buyer education and hand-holding, not self-serve - buyers cannot self-onboard into a category they do not yet know exists. This argues for a high-touch, evangelist-led motion that sells the vision plus live proof points (MCP Server GA July 2026, Companion, AI Tutor, Skills Intelligence) to early adopters, then converts to proof-led selling for the mainstream in 2027+.",
      "competitive_pattern": "Agent 1 Q5 finds the dominant incumbent motion is sales-led enterprise land-and-expand, especially install-base attach (SAP/Workday/Cornerstone attach learning to their HCM/suite base; Glean runs consultative enterprise sales with a paid ~$70K POC). The lone outlier is Microsoft 365 Copilot's PLG self-serve add-on riding M365 distribution - the single biggest distribution threat. Agent 1 Q5 pattern_gaps explicitly identifies the open lane: a Microsoft-style 'attach to existing footprint' play is available in the learning world - AgentHub should weaponize land-and-expand off its OWN installed LMS base (replicating Copilot's distribution advantage on Docebo's turf), and differentiate on evaluation friction with a guided POC lighter than Glean's $70K paid POC. Going against the market default with full PLG is unwise (AgentHub lacks M365-scale distribution and the deal is too complex), but the install-base-attach variant of the dominant motion is exactly where Docebo has a structural edge."
    },
    "buying_journey": [
      {
        "stage": "Awareness / Category framing",
        "actions": "For existing LMS customers: CSM/AE flags AgentHub at QBRs and renewals; in-product and Community announcements. For net-new AI-forward NA accounts: triggered by a top-down AI mandate (new Head of AI/CAIO), knowledge-fragmentation pain, or an LMS-dissatisfaction event (Agent 2 behavioral_triggers). Buyer encounters Docebo via category-defining thought leadership and the MCP/agentic-AI story.",
        "content_needed": "Category-defining content ('closed-loop knowledge -> learning -> skills with agentic AI'), the knowledge-fragmentation pain narrative (1.8-3.6 hrs/day lost), Josh Bersin-style analyst validation, and the MCP-native-in-Claude/Copilot/ChatGPT proof point. Inspire 2026 keynote / on-demand sessions for the warm base.",
        "drop_off_risk": "Net-new buyers do not know Docebo beyond LMS (the explicit constraint) and may bucket it as 'just an LMS', or dismiss the category as vaporware because agents are not GA until fall 2026 (Agent 1 Q10 category-establishment risk)."
      },
      {
        "stage": "Consideration / Champion business case",
        "actions": "CLO/VP L&D champion (paired with Head of AI in AI-forward accounts) builds the internal case vs status quo, Glean/Copilot, and legacy LMS. Champion socializes ROI (time-to-productivity, content-creation efficiency, skills uplift) to CHRO/CFO. Vendor delivers tailored demo on the customer's own connector stack.",
        "content_needed": "ROI calculator / business-case template, closed-loop differentiation one-pager vs Glean/Copilot (answers vs trackable learning), competitive battlecards, reference logos and customer case studies, packaging guidance to counter premium-price anchoring (Agent 1 Q6).",
        "drop_off_risk": "CFO/CHRO ROI gate stalls without quantified proof (Agent 2: CLO 'cannot prove ROI'); price anchoring against ~$6-11 LMS PEPM (anti-ICP); champion cannot articulate a measurable business outcome (Agent 2 anti-ICP change-resistant orgs)."
      },
      {
        "stage": "Technical & security evaluation / POC",
        "actions": "Guided POC (lighter than Glean's ~$70K paid POC - Agent 1 Q5 open lane) proving 20+ connector ingestion (Confluence/SharePoint/Slack/Teams/Drive), HRIS/SSO integration, content-generation quality, reporting. IT/LMS-admin evaluate; CISO (and EMEA DPO/works council) run security/governance/AI-transparency review.",
        "content_needed": "Solutions-engineer-led POC playbook, security/governance pack (SOC 2 in NA; GDPR/EU AI Act readiness, sub-processor lists, EU residency, BSI C5 for DACH), connector reliability docs, admin-burden/ease-of-use proof, sandbox/trial environment.",
        "drop_off_risk": "CISO/DPO blocker kills or stalls on agentic-AI-touches-employee-data concerns; in DACH, missing BSI C5 / EU residency / works-council consultation is deal-fatal (Agent 1 Q2/Q9, Agent 2 blocker). Unconfirmed Zive EU-residency/BSI C5 status (Agent 2 gap) is a live risk for the EMEA path."
      },
      {
        "stage": "Procurement / Legal / Negotiation",
        "actions": "Procurement (decision-maker ~53% of the time - Agent 2) negotiates price, terms, DPA, sub-processors, data residency; Finance/CFO signs the ROI business case. For the warm base, co-term/renewal leverage compresses this step.",
        "content_needed": "Transparent-enough packaging and PEPM + AI-consumption pricing logic, DPA/legal templates, security attestations, multi-year and co-term renewal offers, executive sponsorship for large deals.",
        "drop_off_risk": "Premium pricing vs legacy-LMS anchor triggers margin pushback; opaque AgentHub pricing (Agent 1 Q6 gap) lengthens negotiation; bargain-shopper anti-ICP profiles churn out here."
      },
      {
        "stage": "Onboarding & Expansion (land-and-expand)",
        "actions": "Land on platform base (LMS + Enterprise Knowledge + Skills), drive adoption in flow of work (Teams/Slack/Salesforce), then expand via more connectors, more agentic-AI consumption, more business units. CSM/SE own the expansion number with sales.",
        "content_needed": "Adoption/change-management enablement (77% of AI failures are change-mgmt, not tech - Agent 2), usage/value dashboards, expansion playbooks, skills-program rollout kits, reference/advocacy program to recruit case studies.",
        "drop_off_risk": "Shelfware / pilot stall - 34% of AI projects abandoned pre-production (Agent 2 anti-ICP); shallow deployments that never expand (validated land-and-expand failure mode); CS/sales misalignment on who owns expansion."
      }
    ],
    "team_structure": {
      "required_roles": [
        "Enterprise Account Executives (net-new acquisition for AI-forward NA accounts)",
        "Account Managers / CSMs owning the install-base upsell-expand number (the #1 segment)",
        "Solutions Engineers / pre-sales for connector + security POCs (critical given the agentic governance bar)",
        "Partner / Alliances manager for SI, technology, and MCP/AI-assistant ecosystem partnerships",
        "Product Marketing for category definition, battlecards, and ROI tooling",
        "Demand Gen / Field Marketing for ABM and event motion",
        "Content/Thought-leadership lead (leverage existing active content program)",
        "Compliance/security enablement (or a security SE) for the EMEA/DACH and CISO/DPO track"
      ],
      "constraint_gaps": [
        "Constraint: 'team is scaling but not unlimited.' Sequencing recommendation - Phase 1 (now): lean hardest on EXISTING assets that need no net hiring: the install-base CSM/AM motion, the existing content marketing program, Inspire, and the MCP proof point. This is the lowest-cost, highest-yield path to early reference logos and revenue.",
        "Gap: a dedicated Solutions Engineering bench sized for agentic + security POCs may be thin; the CISO/DPO governance gate (Agent 2 blocker) is the most common stall point, so SE/security-SE capacity is the first incremental hire if POC throughput is the bottleneck.",